Insult,ID,Comment,,,,,,,,,,,,,,,,,,,,,,,,,,,,,,,,,,,,,,,,,,,,,,,,,,,,,,,,,,,,,,,,0,2693,really that all you have fail troll is fail lol come back when have something better
0,2694,we d aciddragon nonstopdrivel n do need no fucking basketball
0,2695,you are awsome cena
0,2696,thought there was another race for a minute there
0,2697,er vist en pc elitist for peke ut dette
0,2698,liked your comment
0,2699,if you have an adopted mother must you also have an adopted maybe you just pick the most prestigeous step mom your dad says the rich are different
0,2700,strong assuming something only makes an ass out of u me watch complete video people who annoy you http
1,2701,hatethehype you are an idiot neil was joking
0,2702,imprisoning black men disproportionately obama does it are you seriuos a terribly ignorant
0,2703,this munro fellow seems to be an amateur working for an amateur website founded by that privileged and pampered amateur fucker carlson
0,2704,up to a jury dont you think have been nice to see the horse groomer have the of a court system
0,2705,theprofhypo and that the truth
1,2706,do worry bitch i no more read this shit now just shut the up
0,2707,reply to above derp and substitute your derpy
1,2708,you do seem to get what i am trying to say so good day i sick of anything that you disagree with i not going to be pulled into your
1,2709,dont worry how i sound u bitch made faggot ass nigga
0,2710,i do know how to break this to you but you are in for a period of disappointment
0,2711,when you get a officer needs help call you put your donuts down and you help you do wait to finish like a normal call
0,2712,they do that even on channels with old tv shows for example
0,2713,los angeles kings jersey devils goals on the minute powerplay dumb shit that took the charge may have just caused the devils the cup
0,2714,one of my big is who does berry think he is to sign a bill like ndaa that says he can pick me up anytime if i have done anything or and detain me forever
0,2715,bet tim cook just shit his pants
0,2716,holder would be lynched if he tried such a stunt why do you see if you can get back to that was when president bush left office we now have the losers holder and obama who are clueless
1,2717,i bet it took awhile for this guy to extract his foot from his mouth
0,2718,i do want to lease hamels for one nbsp no way angelos pays for him next nbsp and we will already have lefties in the rotation come mid br
0,2719,well then stop having a go at me one of the few people here defending nhs
1,2720,what a dumbgeister it is f for failure all your distorted life if lies
0,2721,free suck it up quit whining and make the effort to get the free id if people will just not go through it then they want to vote badly enough talking minimal standards here kinda borderline pathetic
0,2722,wow my second bias dancing a cover to my ultimate bias song iu ur too amazing haters it nothing serious she was just having fun
0,2723,yes or no the age old question
0,2724,one need look no further than durden profile
0,2725,if you had the choice to shoot fireworks with mario balotelli and his brother enoch inside his flat or get a tug from chelsea would it be and why
1,2726,white men like to rape little boys
0,2727,svs needs to learn about contact alb not ready for prime time package bait this also not ready for prime time but will be a keeper looks like a seasoned vet can not buy the next ticket out of lax fast notorious september burner has carry legit just need to invest the fear got ta find a way to keep him in when kemp comes back
0,2728,lol looks like he got up in the night and tried to give the ironing board one and it hit him striaght in the mouth judging by those gnashers
0,2729,hahah it says donate over times
0,2730,and as usual you blaming the wrong person i just a voter and have nothing with the decisions that any politician makes regardless of party affiliation
1,2731,say it is so caught editing tapes again been editing stories for years to fit their fleabagger viewpoint for years now is just that no one ever called them on it you all have to remember that msnbc nbc all the rest of the fleabagger libtard networks are nothing but a bunch of focking hacks i just ca wait until these fleabaggers are off the air permanently there are fleabagger networks compared to the one conservative network which is fox network has been fleabagger networks in the nielsen the last years ha ha ha you stupid fleabagger libtards will never learn will you fleabagger networks are losing viewership because of your made up news even other fleabaggers know the bullshlt you are they do appreciate it
1,2732,fake pic u hoe ass nigga
1,2733,wife you are a vile racist bigot
1,2734,really police would use tear gas on a white man wanted for counts of capital murder you are such a fool
0,2735,yaelah cow jaman skrng pamer jg pnya ortu lo orng biasa ja tp pnya hasil krja sndiri
0,2736,i think the sausage might make all the difference the white peppered gravy sounds fine it just the idea of pouring it on what appears to be an unsweetened scone and calling it a meal seems you do have kippers that seems strange i thought that every homestead had a smokehouse and there are herring in the i like your scots irish theme there might even be an ulster scot right here on my t
0,2737,he shaves his legs in front of his daughters
0,2738,lol god damn you yes
0,2739,haters are just fans in
0,2740,i like the way the government poured pig fat on the injured iranian that didnt quite blow himself to he ll
0,2741,you do know much about the housing policy do you
0,2742,funny seeing the cop run up all then jump back like wtf
0,2743,dick cheney lied about atta now this is news actually most of this was confirmed a long time ago and nearly everyone who read any of the books on cheney the only thing that is confirmed is that he intentionally lied and there is a paper trail that shows he intentionally and this is why he should have been put under oath when they did the then we could get this bastard for maybe this will keep him and his ignorant daughter off the television machine for a while but i seriously doubt these people have no fucking pride whatsoever he probably be campaigning with romney next week somewhere
0,2744,actually clearly not maized because you ca impersonate i did jwoude that is the prick behind this he had better come up with a better name for me than some fucktard dds that is pussy and not at all on the level of ass fuckery i expect to come out of our bet
0,2745,you r getting too old before you hit the post botton see how many posts there already open them up then post yours
1,2746,burr headed purple lipped kenyan are you a human or a right wing go back under your bridge
1,2747,guess what no one gives a fuck about you get off snsd articles
0,2748,great post dan what an amazing story you did the right thing i know i have an experience just ca think off the top of my head i think what you did was pure kindness some people may not have stopped and even talked to her im sure where ever she is i know she is telling the same story about how an amazing guy called and helped her she may be wondering how you are i guess the best part of life is not getting credit but just doing good deeds and just moving on very awesome dan
0,2749,i know more intelligent fans of the timberwolves than intelligent fans of the heat those people are clueless for the most part
1,2750,only does your ignorance shine through per your ignorant comments but you ca spell or form a sentence pathetic loser
1,2751,you are a lying son of a bitch see you post some facts supporting your assertion
0,2752,dude dont wan na hear your pillow talk about double pent
0,2753,that why the more non whites we let in our country the more interests of our country get aside no matter what non whites and whites like us will always utilize group think us or them no matter what we are screwed people do think about these problems when discussing demographic change it not black and white no pun intended like most people perceive it to be most people think it will go one of two ways good or very bad there is vast amounts of grey area very complex cause and effect deals
0,2754,this is true
0,2755,off of baseball for the moment you guys should sit back and watchthe hanoi hilton movie capture the perseverance and dedication of men who have served this country
0,2756,holy shit those are creepy
0,2757,screw you not all inspirits are like that destroy us please you wish inspirits are underestimating infinite popularity
0,2758,interleague play is retarded
0,2759,they have a right to be gay since they choose to be they dont have a right to trample our countries heritage to match they perver ted lifestyle
1,2760,you shut your whore mouth you shut it right now you giving him ideas goddammit
1,2761,back off leave them alone cuz its none of your bussiness bitches ignore them olsen
0,2762,i wish you could smell it just by clicking on it
0,2763,fuck this something will be on youtube later and photos will be on gillian anderson website i sure
0,2764,chesire krayoncolorz bpicampus catholic priests will minister to soldiers who are killing people on the battlefield that not implicating itself in a practice that is morally anathema to it i really do understand the church delicacy of conscience when it comes to human reproduction and it ability to suck it up and accept reality when it comes to things like war and capital punishment
0,2765,joseywhales thank you kindly for proving my you have no actual information to present just thanks for the entertainment
0,2766,well as long as they do bring back long dead fri shit hang on
1,2767,yup gang of little nigglet thugs
1,2768,go drop dead you fcuking loser ram a boom stick up your hairy ass you sex starved unbalanced freak fcuk
0,2769,let me help you get your anger out
1,2770,leave it to a moron to dump smoldering embers into a trash bin next to a house
0,2771,all the people saying well
0,2772,where exactly you are questioning logic without an argument
0,2773,it is obvious that has turned into a popularity contest with a huge female viewer base as proof for the past three seasons the has won over the much more talented female runner cares more here http line may
1,2774,how the fuck did you come to the conclusion that she initiated anything you sound like one of those punk niggas who would find any excuse to hit a girl go sit doen in timeout
0,2775,we want to do is adopt a highway
0,2776,it built like a brick shithouse
0,2777,who are you a fan of what your team
0,2778,see waht you knowit not all there
0,2779,norway is a proud nation what war crimes did they commit
1,2780,white people invented taco bell you ignorant fuck you dumb as this nigger in the video and i aint no fucking wetback wetbacks are mexicans who swam across the border i was born and raised in san jose california so fuck you and by the way i like peanut butter and cell phones so stick a burrito up your ass im sure thats the only way you can enjoy it
1,2781,you either know that is a lie or you have not checked
1,2782,go and tell him to fuck himself the twat
0,2783,scusa non ho capito che festa
1,2784,honey get some brains because quite obviously you did read everything i said reread it and if you still have the same crap to say then and by the way i am a grown woman not a little boy you racist stereotypical bored ass son of a bitch who has a lower iq than my dumb ass dog you have had to live the life of a minority so pull your head out of your ass get some real research like maybe live like us minorities have to and then go realize how good you have it you white ass rich kid bastard and good job by the way you threw some big words in there to make you sound intelligent too bad your argument still sucks
0,2785,so you think cigar willie clinton will help obongo win balack obongo learned his lesson too late you cant trust a fuckingliberal just you cant trust a liberal troll commenter
0,2786,attention all white people do not be comfortable saying nigga i personally will slap the shit out of you so will some of my friends it as not acceptable no matter what you what to think just whisper it under your breath like you been doing
0,2787,ight kool dont u know d shit u be saying would fuck u up some day and see my said
1,2788,i just checked and there are many races mixed in spain if she called herself hispanic then she has that in her blood you are so arrogant of an online troll that you think you know about people you ca possibly know about it sickening
1,2789,that was the fuck of that lil cunts life job
0,2790,because the person is full of shit and has no one to talk to trying to stir shit no one gives a shit about perry anymore he in jail and on his way to prison where he will be squealing like a pig when bubba gets a hold of him
0,2791,no they are only you and your names
0,2792,naturalblues disqus i used the cars from my train set as pretend rollerskates all the time the worst accident though was when i tried to use them to go down the stairs in our apartment complex not ride down a hill i think that was an even worse idea than yours
0,2793,that second picture of him is not that appealing but it cancels out with that first picture i still want you in my bed kibum
1,2794,if i did know better i have thought you were the one who wrote this piece of tripe in a sacramento publication no less for the career long cheap shot elbow throwing adulterer and accused rapist saint kobe boy karma is a biatch is it does matter kobe dolt should even be mentioned in the same breath as lebron man child could carry his sack just something you and other faker fans can fantasize about for you my tiny little faker worm it time to crawl back down into your little hole your old girls are going down soon can bet on it am life is good
1,2795,are you proud of your trolls
0,2796,it was an out does matter how sloppy
0,2797,how dare you call me fool
1,2798,lmao do people who hate gays and lesbians really think protesting will get us to stop having kids and being a family you serious its funny how everyone quotes the bible but it also says divorce is a sin being a drunkard is a sin being a bastard is a sin cheating is a sin have you idiots not read the commandments those are all abominations you anti gay homophobes are so ignorant karma is a bitch you just wait and see haters
0,2799,one season wonders its game over begging in the making
0,2800,good to see you feeling better old couple of snifters on your birthday and you be as good as new have a good one
1,2800,fucking idiot
1,2800,youre fucking retarded
1,2800,you are a moron come on be a man and call it like it
0,2800,the carling cup is the new liverpool the liverpool fans going to be wearing kkk white hats
1,2800,look at the momma drink when she was pregnant
1,2800,you an idiot
1,2800,you know you love when i give details like when you suck my cock and i say swallow me while i finger your asshole
1,2800,still here love getting smacked around huh just keep coming back for more
1,2800,and you fucking pinterest up it used to be so cool and friendly before people like you found a way to abuse it
1,2800,i admitted a work history that included protecting kids from creeps like you the nypd ronald reagan not only visited us twice but praised us in a state of the union the ny giants came to lift weights and a republican cabinet member came out fan fare to serve dinner every now then i guess nancy reagan hugging our kids made her suspicious too get a life and speaking of life once again what has your miserable life ever amounted to
0,2800,you did your job you redirected a ku basketball article to football job as far as your earlier post misery fools did start talking trash i threw it back at them really funny is misery fans talking about a mediocre football program agreed better than ku on a ku basketball article pussycat you do like my posts do read them do not post on misery articles although i do read them on occasion scanned the posts from their fan base interesting bunch a strange mixture of a jim jones home brew straighten your antlers and march to the east of the sec or wherever alabama tells you to your new boss same as the old boss
0,2800,i love how all the losers retardicans especially those in the adminstration coming out of their rat hole to throw stones at obama the american boy if its so easy why did you and your loser boss quit on the mission
0,2800,a fair man you are
1,2800,why are you still here then like you are anything but refreshing
0,2800,fight for money go ahead kill yourselfs all for greed common take decision that is not in accordance with what the supreme court says find some connection by the inec and say to yourself ho is my turn to loot not yours or i kill of shameless idiots
1,2800,you are not one of us fuck off fag
0,2800,the keynsian economiic imperatives are obvious to almost all economists and the vast majority of lay persons who have read an introduction to economics the plutocrats who make the decisions have material self interests that are inconsistent with the general prosperity for example corporations owned by the plutocrats are acquiring foreclosed and distressed real estate all over the globe for small fractions of their former prices also the corporate plutocrats are breaking the already fractured bones of organized labor everywhere from wisconsin to canada to greece the plutocrats and their authoritarian allies in the clergy have so successfully degraded public education that there now are hundreds of millions of devotedly ignorant and sanctimoniously stupid voters who sincerely believe it is more important to keep homosexuals from kissing than it is to feed the world is dying all over the globe and soon we will revisit the desperately hate driven politics of the and
0,2800,period at the end
0,2800,bailey is built for sex so hot
1,2800,nope i have a unlike you
1,2800,how many times do i have to tell u retards i dont live in the uk it was when i commented u utter bellend
1,2800,i suppose it just to give retards like you something to do
0,2800,to all of you cowards like me who do use our real when you people try to exchange with dave trabert you really look foolish not using your real you lack all credibility yet you try and argue with dave is courageous and the rest of us are not
0,2800,so is your mom
0,2800,idea that chappelle in whiteface is potentially as offensive as ted dansen in blackface is frankly fucking ridiculous and honestly makes me ashamed to be the best argument for mcgeeeeee being the new siiiiiiiiiiiiiiiiiiiims
0,2800,con yeah
0,2800,westbrook could not handle magic jock
1,2800,let me rephrase my initial comment about you and your post little boy
0,2800,with four straight balnced budgets leading to a surplus and welfare reform he was a conservative
1,2800,thanx for the fake address knew you were a bltch go tell your mom to bring you some cookies
0,2800,you fucked it u up with stupid music like most these whack niggas do weak sauce homie
0,2800,non sono un influencer e non ho letto non ce sono limitato a leggere le domande la media era di sette o otto parole per domanda a cui seguiva un paragrafo di lo stesso stile delle interviste a berlusconi
0,2800,the other ed why do you want to pretend that retards believe in facts
1,2800,we are not talking about incest here you fool your common sense when making an irrational statement that you claim is rational
0,2800,looks like you twist and rk are the only two here today good game so far huh trout is being ridiculous again i wonder how many more ab the kid needs the lead league in batting avg anyhow you guys have fun watching and rapping about the game go angels
0,2800,ca billy joel make a song about it
1,2800,you are a
0,2800,he only comes here at times to post
0,2800,you are so confused
0,2800,you are brilliant
1,2800,lazerbyte shut the fuck up so where do you shop your clothes k mart if you dont your a sucker for clothes brand like hollister or american eagle or some skater kill yourself your ignorant
0,2800,people like you just do understand the character
0,2800,yeah you got your rights but you and your mama will be tossed into frikkinghell because you rather obey man than god
0,2800,i think people like you are the cause castism which is hindering india development
1,2800,i wan na skull fuck both of that is after i blow ur brains out with my shotgun in a horrid mess you low life fuckin imbiciles
0,2800,do the angels have an outside shot at the world series
0,2800,xd jajajaja soy fuck yeah aunq me perece real xdd porq siempre me sale las cosas bien y no tengoq hacer nada xd
0,2800,make a good point despite being challenged
1,2800,reported you redneck coward
0,2800,lem me hole it
0,2800,it just your opinion indy as good as anyone elses
1,2800,go away libturd your kind just ca stand that the man told the truth something you would never understand
0,2800,the illegal rats he gave semi amnesty to can not vote in anyway there not enough of them to make a difference the white vote is the most valuable and important since there more of it obummer pissed off a lot more whites than appease illegal mexicans
0,2800,nobjustryan david to be specific streaming over sites
0,2800,cast a vote then get back to us
1,2800,are you asking because your mom wants to sell your anus to her crack dealer
1,2800,it not the acting i talking about it the rediculous salaries for something that does benefit humanity other than entertainment sorry you misunderstood you must be an actor if you are i hope you do great things with your money to help our society instead of spending it on material objects that wo help you when you get sick just saying
0,2800,you is so right
0,2800,votul meu pentru ca de ce iubesc de ce as iubi niste varzari
0,2800,his deserve the beating you commit an offence why resist arrest had he just surrender his ass would have never got beaten pure ignorance a police pull you over you keep your had on the steering wheel and do say shyt unless he ask you a question and you answer without an attitude when police have a problem putting you under arrest your ass deserve a beaten now instead of getting a traffic ticket the dumb nigga get a felony charge and may be time
0,2800,look man i do think you an idiot your statement did make sense that all relax some fans say stupid things because they stupid fans or they trolls or whatever i can agree with that i just ca even believe how defensive you got about your intelligence level yikes
1,2800,and you really believe she paid for that car really damn you dumb lmao
0,2800,are kidding me still have idiots that do understand this yet
0,2800,main problem with the vatican is that they play by their own set of rules its why they have been able to get away with molesting little boys for as long as they trolling
0,2800,mieux david
0,2800,i would say the detective and genious
0,2800,my momma always said re leann rimes i may be a little overweight
1,2800,s t f u and pay your dues
0,2800,post where you got it from as that is the honest thing to its like stealing unless you post the source
0,2800,lestatdelc keep licking that democratic ass and see where the blue dogs take you
0,2800,good to see the police where able to get their in time to help this lady get to a rape kit the police should be held accountable for allowing her to be attacked after all according to the anti gunners the police should be all we need
0,2800,cant belive what iam reading this libatard belives that jimmy carter was a good pres what a looser dont worry odumbo will blow jimmy out of the water for worst president ever
0,2800,tv we are so short staffed we have tons of stuff in our group right now that only one person can but this pisses me off because this was data i processed it was circulated ages ago and she should have been looking at it then not waiting until the last fucking minute before it goes out to find issues and calling the boss instead of sending out an email so everybody could have a clue what was going on well the boss is going to hear about it when she gets this particular person always tries to pull shit when the boss is away
0,2800,example of a government gone nuts additional regulations will come at a cost one conservative estimate is that gasoline prices will increase cents more per another outrageous example of an unreasonable regulation
