Insult,ID,Comment,,,,,,,,,,,,,,,,,,,,,,,,,,,,,,,,,,,,,,,,,,,,,,,,,,,,,,,,,,,,,,,,
1,1,you fuck your dad
0,2,i really do understand your it seems that you are mixing apples and oranges
0,3,of canadians can and has been wrong before now and will be again unless you supportive of the idea that nothing is full proof or perfect so you take your chances and if we should inadvertently kill your son or daughter then them the breaks and we can always regard you as collateral damage like in wartime and sorry cheques in the mail
0,4,listen if you dont wan na get married to a man or a women dont do it what would it bother you if gay people got married stay in your lane do you let them do them and your god is so nice but quick to judg if your not like him thought you wasnt suppose to judge people
0,5,giang ta khi sau tranh con
0,6,sdl ok but i would hope they sign him to a one year contract to start with give him the chance to be reliable and productive but give themselves the out if all his time off has hurt his playing skills or if he falls back into old habits
0,7,yeah and where are you now
1,8,shut the fuck up you and the rest of your faggot friends should be burned at the stake
1,9,either you are fake or extremely stupid maybe both
1,10,that you are an idiot who understands neither taxation nor women health
0,11,jdstorm dont wish him injury but it happened on its own and i doubt he injured he looked embarrassed to me
0,12,be careful has a fork with your name on it
0,13,tonnyb or they just do pay attention
0,14,hmmm perhaps some who are too pig faced to get laid and therefore have zero chance of getting pregnant from such activity hold something against women who can idk stream of consciousnees thought after looking at her
0,15,barrettmarson huh her income was her spending was my math puts that at
1,16,for some reason u sound retarded lol damn where u been negro
1,17,you with the screen are a pieceofshit
0,18,oh cheating as well cup was a cheat fest you still dare to post that on you lol
1,19,your such a dickhead
1,20,your a retard go post your head up your
0,21,you want to say mike macwhogal
0,22,http
0,23,and you know they burned holes in all the carpeting
0,24,you are a land creature you would drown
0,25,to all those doom and gloomers the chicken littles who claim the sky is falling and that society is collapsing canada has had gay marriage nationwide for years where is the disaster where is the collapse and the persecution you shouting about where is it please show us some examples because it starting to look like your threats and fears and warnings are nothing but hot air
0,26,craig we have been saying from the start that this is a very entertaining it awakens the horny little goth in i met my boyfriend during the first season and one of the first thing we did was watch ahs at my i know he likes me and all but to this day he is sure i am far creepier and kinkier than he could ever thanks american horror sweet clam loves you
0,27,strange you are talking about that when there were chelsea fans in here belittling the community shield
0,28,but how would you actually get the key out
0,29,oh cool some more internet points for your collection
0,30,even though i think there are better coaches out there i am glad del negro is keeping his job i never thought he got enough credit those years when he took those average chicago bulls teams he coached to the playoffs years in a row
0,31,how can we spin obama honoring vietnam troops as something does matter look at our followers they take team
0,32,a good article which for all the good it will do could have been delivered to a brick wall
0,33,head up warning another source of funding for media matters is peter lewis of the progessive insurance company you know those auto insurance commercials that run every minutes on cable television featuring the gal who looks like a blow up doll with red lips perfectly round mouth if you know what i mean if you have insurance just know that part of your premium is going to fund a progressive hell country and our free speech their mission is beck dobbs lavin limbaugh boortz etc we must not let them win
0,34,sdnoriko lol as if capcom listens watch them fuck this up too i hope i am wrong i love okami
1,35,sickening you ignorant loser
0,36,fast furious did work out like they planned did it
0,37,mitt is the best candidate for president going against the should help him tremendously is one and done it could happen no other way
1,38,i ca believe the stupid people on this site that have no idea what is going you you are all useful they are hiding the truth because you fools who protect him would look like the useful idiots you are
1,39,fucking behave then you prick
0,40,the only other relevant fact is that he is destroying america
0,41,you are a liar
1,42,is that it your sum total to any conversation is first abuse and then calling them a you are a typical socialist idiot keep up your non existent class warfare it is as pointless as you
0,43,beanstalk briview welp then nbw right
0,44,good job fellas i did quite read the rules about a signature piece but i guess that was as good as any i found some great blogs to follow and to share over at if i not commenting on your blogs it because i always throw my two cents in when i post my share add me on there if you are a googler again congratulations to the winners and i hope we get the chance to submit something else this was fucking fun
0,45,i say hang is ass in the center of the town to let it be known that this type of behavior gets this type of punishment the lady had a kid week ago women are safe to have sex after child birth for at least weeks so even if this it would have been wayyyyy too soon and hurt the lady i am so glad the the baby is so young and will not remember this event happening in it house and i hope the mother recovers quickly
1,46,faggot
0,47,you right if you are relaxe then you can give better result or perform and your identity should be from your work
1,48,aimless abe you are a delusion weirdo that should be locked up inside and kept away from anyone who doubts the lunacy of abe the moronic prog frog from nyc please read this thread and you will see abe completely come apart from the seams and go off the deep end
0,49,that i do not doubt a blackberry your original argument was not that android would have existed just that android somehow predates ios development
0,50,okc should work out a deal to get a pg who plays more like parker or i think nash at the point and move westbrook to sg that team would be unstoppable imagine the shots nash would create for durant then westbrook would be at his natural position too the guy does create shots or distribute
0,51,show goes on and on alakda show gets the free market wonderful
1,52,even as a troll you are a pathetic failure
0,53,grazie mille sabrina sei
0,54,yeah well it would still be better than letting them sit there for years on my dime before sticking a needle in their veins i say give them all a noose if they choose to kill themselves so be it
0,55,fuck i need a cigarette
1,56,you a moron truth is beyond your reach
0,57,you seem wistful
0,58,damn speedy recovery paul raining prayers down on you
0,59,the laughs you two heard were triggered by memories of his own high flying exits off moving beasts
1,60,your anti semitic rants are not welcomed here you are a racist
0,61,nonstopdrivel was fredex on this team
1,62,god you tiresome get a life you loser
0,63,stop pretending ur not bradley side you the u blind do give us that of yours like that idiot judges exactly carbon copy arum we need our moneyyyy bacckkkkkkk
0,64,fucking weird game man
0,65,i told you i would give it if you did you started acting likje a tough guy behind your moms computer then i asked you times for an address and you still wo give it
0,66,i do know if lewis is a little boy or little girl either way it becomes the third on my list of petulant idiots you will understand when you grow up ask an old bastard member of your family to explain such actions can not be tolerated how come you blame the line judge weird
0,67,thats a pathetic flop fuck you jvg
0,68,why should they bother improving ios if they sell more phones than they care to produce these advice are better served to the also runs wp first and foremost
0,69,spursruss i live in argentina and its not all argentinians the problem being those who are loud on the issue are ill educated and you can be sure they would be rushing to fight anyone they would be cowering in the background my wife is argentinean and she is the first one to recognize the stupidity of the claims some of muppet think they fought their independence against the uk morons the lot of them the answer is simple if we were the leading colonial force you would be an english speaking country you are because werent it was spain portugal france our interests were commercial also the worst part is they themselves exterminated the natives the spanish started it but actually it was the newly formed argies which did most of the killing of the native lovely eh clueless stuff you wonder why the government gets away with corruption so many ignorant people thats why you shouldnt judge all by the standard these a huge amount of argies who see the cristina drum beating for what it is the same as all presidents of argentina do using it to cover their failing
0,70,you better hope because the marlins have a history of giving up their superstars
0,71,well you guys have gone and done it now you put the words and up the required number of times for the dating asians ad to come up evidently zhang and for a bmi of from china wants to meet me she has her little mouth open like she speaking what that you ask zhang well yes as a matter of fact i am a physician why are you clapping your hands together and jumping up and down stop that squealing young lady and yourself
0,72,you mean like your off topic obama rant bellow
0,73,i hope they do it inconjunction with july
0,74,surely will be a crushing blow when he does get the next four years would you consider leaving the country
0,75,i have watched fox news in years true
0,76,are you in france
0,77,i take that temp i really hate the heat
0,78,alexis bledel can act wait can she i have this blind spot when it comes to impossibly beautiful women shit maybe she ca act fuck what the hell do i do now the hell do i do now
0,79,like your i would go one step further it not time to let the people of il fight the citizens of il just need to fight back period will carry next time i travel into little beirut
1,80,fact georgia passed a strict immigration policy and most of the latino farm workers left the area vidalia georgia now has over agriculture job openings and they have been able to fill about of them in past year all you white real americans who are looking for work that the latinos stole from are you the jobs are i vadalia just waiting for maybe its the fact that you would rather collect unemployment like the rest of the tea you you sit at home in your wife beaters and drink real white tea klan
1,81,of course you would bottom feeder
0,82,kill it with fire
1,83,you a fukin moron you are just butthurt that you got rejected on yoursilf scolar or i am better than you just and already a wikipedia you are just a stupid ashole
0,84,he is doing what any president doe on this do not recall if other presidents appeared at the year yea but then again you would never say he did not appear you can not have it both ways
0,85,yeah and you a expert back to picking through trash barrels you tool
0,86,those trails will definitely get plowed regardless of the investigation they just see it as easier to plow the area than deal with it and once they got plowed i would never return or risk getting stopped and heavily questioned by the po po all the stupid comments are unnecessary it really easy to be cold and heartless and act like you do give a fuck but i like to see these anonymous commentators talk shit like that in front of this person family or even their own mother grow up children and learn some respect
0,87,suh had a sack the last time they played
0,88,and you are support argument a hole everyone games on their pc either whores miss the point entirely prefer the mac to my daily work beings said i also a big believer in the best tool for the job and there are certain things that pc do better database and servers for instance thing is that you havent proved anything other than an anti apple bias and name calling guilty myself to get your attention id just juvenile
1,89,you are a fucking dumb ass go back to you xbox dickhead grow up you little fanboy
0,90,you know what would be fun if you guys talked crap back to us more entertaining
0,91,beeline sidneycatsby i assuming you are in school in the states
0,92,they should put all the gay and lesbians on an oh wait there is manhattan
0,93,yolo this is hilarious canyon students are so racist even though most of us are mexican fuck gabby
1,94,lets see your papers then shut the fuuk up sticky chin
0,95,an interesting angle of organized religion is that religious persecution is never ok unless your defending your own you all are victims of religious you are the btw i not i just love how you people try to defend your persecution of others while claiming your are being persecuted
1,96,correction bitch you do think it superb because your hating ass does know again i am still waiting on you to submit a video of you is the youtube link i am sure you will get all kinds of rave reviews lol
1,97,i think the only trickle that effected you was the trickle of sperm your dad gave your mom and most of that trickled down her leg go back to sleep we will wake you when you are needed again
1,98,and you keep on your knees and keep telling yourself that is a sausage in your and that is cream cheese you are swallowing
0,99,what was that like words about nothing you going after andrea mitchell what was fox infomercial not broadcasting yesterday how about the apologies issued for the epa drones and yet here you are attacking andrea mitchell about some stupid gas station another newsflash for you romney is out of touch we all already know it romney amazement was just about some gadget at a petrol filling post but that people could actually buy food products there and that they actually eat very second romney is even carrying a wallet and it is very likely that he does even know where it is i still waiting for someone to ask him the tough campaign trail question of how much does a gallon of milk cost mitchell and gas station food unbelievable
0,100,rourke needs to give me a fucking everyone doin
1,101,fuck you both
0,102,powers is far far more biased and hostile in it comments than fox at least at fox there are usually opposing views msnbc is just a shill for the president and they keep having to fire their hosts for all the outrageous remarks they cnn is getting almost as bad as msnbc
0,103,what horrible trades are you talking about
1,104,and retards like you back to the institutions
0,105,weapons lol hes an idiot an waste of human space had it made and ruined it all
0,106,not a big fan of rondo but the dude can ball i would classify him as a big talker just trying to psyche himself up
1,107,pig maher you forgot your meds again you know you are one sick sob so do forget
0,108,it not just the rich screaming about it the average middle class american who pays taxes and does see the benefit of those taxes but instead sees waste i pay federal taxes but i do use public schools i not collecting any govt welfare or benefits i pay for my own healthcare i use the roads and sewers so i do mind paying the city my trash pick up is private so i pay that directly to the trash should pay for what on what they wants to be a part of society one and pay their fair that includes the rich or poor
1,109,king is it about time you either grow a pair of balls or join the democrats who will love a pussy cat like you
0,110,i amused by the fact that weblog cons drop any issue once it turns into a is an expression of that amusement
0,111,time to blow that horn
0,112,exactly like i do really give a shit how fat a person may or may not feel but it really is shitty when your clothes do fit and not in a i so gross way but in a i ca very well leave the house naked way
0,113,welfare queen into a whore not a crack whore think a whore is a more productive worker than a welfare queen
0,114,political correctness correctness is a doctrine fostered by a delusional illogical minority and rapidly promoted by an unscrupulous lamestream media which holds forth the proposition that it is entirely possible to pick up a piece of the clean end
1,115,an ass you are funny i see a lot more of you nuts in cars then i ever have of pilots in panes
1,116,you can take international law shove it you are such a schmuck i don t know why i even comment on your idiotic posts the peace activists on the ship started hitting the soldiers with weapons in order to kill the
0,117,blown is a little pissy after he applied for a union job and was turned down he is just another good republican minion spreading today message
0,118,you dont have a teleport and air mix ups you are nothing to
0,119,stop trying to sound like a victim bitches dont understand men dont have the same temper and not the same thoughts go through ur mind than u put a nigga on da spot get up in his face and start throwing yo stank breath on us believe me u got it coming yal go no right period
0,120,robert moroni you fuckin dimwit do you know what a parody is it a fuckin parody of fox news and it sounds accurate to me
1,121,the most evil callous vile creature in all of mythology is your made up god stop killing and eating babies you dirty christard
0,122,oops embarrassing for me you are right i bow to the superior movie intellect of your son
0,123,if you throw trash out your window you get a yellow star bumper sticker
0,124,once more we see where the soft immigration policy has let the citizens down i bet they come from a family who have less education than a retarded hampster yet were given a nice new life in britain reap what you sow
0,125,nope not working for me you have my email
0,126,that jump shooting bit gets old when you do get calls on contact and get your shot thrown off you look for separation and you jump shoot especially if you ai big which is most teams because bigs and longs are at pro level
0,127,was a tough loss for us
1,128,you a complete and utter moron
1,129,your still a loser man we must have really gotten under your skin lol
0,130,ignorance here is astounding clearly it says in the video that cleveland was already convicted of rape and is serving jail time for it guilty she was raped for all of the morons said ugly statements about her or attacked the veracity of her story the only determination that this court is trying to make is whether cash money should be held liable i think reasonable that when you invite someone to make a professional presentation at your company that you provide necessary protections for that individual i care whether cleveland was employed or just a hanger on a professional guest should not have been left unattended in the hands of someone dangerous that was there admittedly with baby and knowledge and permission if you went to a store and were attacked by an employee or a friend of the boss who was permitted to hang around premises
0,131,fuck hard then fuck slow then fuck hard and then start again
0,132,you here for the wide receiver drama
0,133,are you fucking kidding me no mirrors fuck you freesteam
1,134,nothing was confirmed in the century you moron there was no modern medical science to prove anything dont try to quote from the same period of time that brought us the spanish inquisition you are the lowest of the low i feel sorry for you
1,135,my best friend who is allergic to wheat corn soy red dye yellow dye pistachios tree nuts kiwis cherries oranges bananas and seafood if she gets anywhere near the smell of seafood her lungs constrict and she can no longer breath last week she got cut by a dog leash that had pistachios on it and almost went into anaphylactic i know a little about food asked my friend if she thought it was rude and selfish of someone to want food allergies so they could die she said you are a bitch so i do not really think it is insulting that she wants food allergies so she can die i think we back to you a bitch
0,136,so not focusing on boston vs miami for a minute who the scarier opponent sanan or okc
1,137,floyd has a better knock out percentage than pacman you dumb fuuuuck
0,138,so wat have u bn doing all along if u want to train them thot yo presence must strengthen the strike force bt proving
0,139,the dean of mean is a typical tory who believes there one law for him and another one for everyone steve better get around to firing everyone at elections canada and replacing them with tory hacks before they really get into what the tories did in the campaign
0,140,oh fab we have a tennis player who has a sense of humour and who can smile mr murray please note mind you he has left it too late to cheer up misery guts
0,141,you are repeating yourself mate
1,142,you are one sick puppy
0,143,very true indeed i tried to sit down and study for hours straight without any breaks and i not nearly as effective as when i take a few breaks
0,144,so da fuck wat if he prasie the devil look where he at keep doin ya thing my nigga
1,145,can i say dick on here a dick
0,146,never said it was fool proof tho
0,147,the wonders of plastic surgery
0,148,ron paul cynthia mckinney all wacko ticket all paul sheep to the barn for your daily feeding do forget your wallet
0,149,go on move to hollywood join russell brand and take dan lobe with you
1,150,the way this fucking hoodrat is standing in that picture is boiling my blood i like to meet this cunt in an alley for a few minutes selfish fucking twat
0,151,hahaha today a group of argentine veterans from the falklands war beat the crap out of a senator of the peronist party the party in power right now for using them for political purposes the people in argentina are getting tired of this show the politicians are doing to distract the argentine population from other far more important problems
0,152,we afford what we have to afford marco
0,153,moron
0,154,and like it matters you are waiting for next year i am still living in the playoffs suck on it loser
0,155,should have hung for what he did this country is all for the monsters that lurk among us
0,156,on as long as we are both open and honest about how we come to our own conclusions i could give a shit if we disagree
0,157,they are pecking him to death he gives up ugly runs
0,158,blaine jungwirth definitely thought that only deserved a but hey i takes what i gets
0,159,i ca trend i on my ipod touch
0,160,this was the joint back in the day am i the only one who thought gregory looked like he could be philip michael thomas brother lol
1,161,how old are u fan beeyatch a melo ball licker
0,162,anything better than the grover norquist tea party wall street corporatist gop
1,163,bitch nigga you need an eye exam and eye glasses cassie one of the finest women on earth
0,164,are you attempting to be kinky here you have some kind of fetish
0,165,you get the gold star the best post i seen on here in months hilarious great job canadian ps i think we need you to come down sponsor you
0,166,how old are you
1,167,nothing worse then a who smugs because of who he is gay
1,168,you a child rapist in ny you have admitted it many times you sick fuck you have no room to talk
0,169,the man was a genius
1,170,anti american piece of shit you are
1,171,have you be sipping at th e sacramental wine again really are a dense little dude
0,172,yes but remember the government is listening to the views of the owner of will loan your at astonomical rates
0,173,the tirade is what people caused people to dislike her read her comments like this one i know of her story and her husband we all have stories i mean i almost died and venus is struggling herself so you know it life comes across as uncaring and selfish on top of that she never gives an opponent any credit it always about what she absolutely like venus consistently root for her and have for years but serena is an absolutely awful person that needs to grow up
0,174,stacy is right dumbama and his fat ass wife and their cronies have created this atmosphere of govt interference and what they feel govt entities should be schools and others take their cues from the top down and when they see this admin forcing restaurants to publish calories on menus then they feel they should be doing their part for their messiah and become food i can not believe that a school puts out an approved food would be
0,175,gallup updates daily at et reflects one day updates monday may next update will be tuesday may day rolling it seems the bump romney got is over and the president is on his game
0,176,this is someone whose self importance got the best of him if anyone should be fired it would be tate this kind of behavior is inexcusable and unbecoming of a man who holds the futures of many employees in his hand
0,177,do stand on your porch
0,178,camp has got to come in here and get this guy this is where you earn your money
