Insult,ID,Comment,,,,,,,,,,,,,,,,,,,,,,,,,,,,,,,,,,,,,,,,,,,,,,,,,,,,,,,,,,,,,,,,0,991,missar det han drar paralleller till och droger som inte alls relevant till om att han inte anser att ska ha att kandidera till han att bli utmanad av politiskt insatt aspergare sigfrid med har en ogrundad att minoritetspartier som pp att i om unga ges men det finns som alla medborgare oavsett skolpolitik och studiebidrag man dessutom inte det och att det besitter med att inte igenom absurt som att alkohol om det nu faktiskt inte ett problem att tag i eller bil oavsett och in absurdum unga eller barn inte ges att en relevant dessa lyftes ur demokratisynpunkt men sigfrid barn klassas som medborgare det synnerligen med en snevriden syn demokrati allra minst en av folkvalda dessa otvivelaktigt har ett svenskt medborgarskap vilket per definition ge dom att barn folkets framtid och ska med ges att om dessa att debatten ska men det ju precis det inte eftersom inte ens vuxna klarar av att vettiga politiska eller sig in i vad exakt en moderaterna efter ett vi saker och ta ut en bit i taget i fall korthet ja till att ge yngre medborgare om dom vill utnyttja denna kan man besluta om att partier inte nyttja fulknep att vilseleda innan detta beslutas vilket en som arbetas igenom innan ett eventuellt beslut tas allt att att politiken blir mer transparent
1,992,klein you are a coward did you really interview these guys just to mock them part is that you stop short of belittling scheartz even you know that would probably be the last straw in your downward career
1,993,oh all of a sudden u changed ur picture to a white guy with penny loafers u lame
1,994,you naive and do have a basic grasp on biology
0,995,nope mets will be fine they have held it together so far and played admirably
0,996,you forgot to mention that there has been little if any proof that the allegations of a fake birth certificate are credible just saying it a million times does make it true
1,997,nobody gives a shit what you say
0,998,you are unemployed and on welfare
0,999,i not saying i agree with that nonsense i said i do understand it nor would i want to live in a city like san francisco for that very reason that does mean they do have a right to live their life the way they want to am i or anyone else to tell them how to live their lives know one gay person a relative he the kindest most giving sincere person i ever known i hear comments from bigots like it makes my blood boil
0,1000,i think if you want all the trophies you should have to play all the game people work hard on that game if you ca be bothered to play it all then you should care so much about not getting a trophy for it
0,1001,looks like there fixin to be a shootout
0,1002,why the hate man done nothing to you
0,1003,that a management issue not rank and file employee like a cry baby just because people other than republican
1,1004,bitch please you are the biggest troll p
0,1005,have to delete comments because i make your posts look like crap mean make all your comments look like only embarrassing y o u r s e l f
1,1006,you do not exist as a human being please go back into your hole you rotten scumbag
1,1007,the article was about bush you asshole
0,1008,they look like morons
0,1009,fucking bullshit do you have a seizure hit a car then get out and speak to the other party and drive off also hitting the same car just to have another accident
1,1010,lukeemery must be too dumb to know what grand jury means who is going to testify against him dead mexican shove your idiotic comments up your you know
0,1011,we do blow up our wives and children in the name a allah nor did we murder in darfur lets not compare apples and oranges
0,1012,warren buffet owes corporate taxes back to he does want to pay his fair share
1,1013,hush little negro do say a word gon na buy yawz some thunderbird
0,1014,moved right jacket stat
0,1015,santorum is the only real conservative as to the occupiers what a bunch of selfish spoiled brats who are morons what have these occupiers accomplished anything of real value let see murder rape robbery vandalism created a huge financial burden for the local taxpayers clean up their messes even child as been reported great accomplishment mom must be so very proud lost all credibility
0,1016,like obamas daddy huh obamas pig daddy had wives at one time
0,1017,i can not believe americans are so stupid fat and lazy you sit around in your lay z boys watching football and listenening to your ipods that you do even care that the country your grandparents and great parents died to protect is eroding away because of evil liberals i never would have even called a representative in this case a health inspector would have had their ass handed to them and then the school principle too for even having such a useless position in the first place who has time to inspect kids lunches and who has to pay a person to do that at any school it time for you idiots to vote out these libs and elect hardcore conservatives across the board who cares who is president if you do have a conservative house and senate
0,1018,how hard is it for the bimbo to use a towel or baby blanket for a coverup toss one in the diaper bag and use it
1,1019,no you are a corny dumb ass
0,1020,they just want a portion of the road so they can carry out their hangings in familiar territory
0,1021,kid or babies daddies not news who cares is i would like to be him when is new brothers hears the comment he had not abandoned christianity or when the change his mind about his jewish blood not talking about muslims in general just the ones that blow stuff up
0,1022,in chicago we say gas station
0,1023,no i know people who re watch it habitually i am in fact related to one of them
1,1024,so you call her a w h o r e making you what pure you a fool and an idiot
1,1025,the same with write people every one do some drug in there life ok not all black people is drug addict so i would like you to stop hating on blacks ok you prick have some respect for him god know y he do what he did ok have a bless night u prick
1,1026,when you say bama you are referring to the school like in your posts below stop being an idiot
0,1027,chill no need to call them an idiot
0,1028,let wait to see what the contract and numbers are before getting too upset be a one year deal that wo have any impact on dealing for a fa
0,1029,whaaaaaat excuse me while i puke
0,1030,whoever takes out the heat in the playoffs will be america team
0,1031,sure they pitcher does not make or break a rotation especially when you have the depth the reds he was expected to come over and be the number he was brought over cause he has the potential to be a that whole deal was basically based on potential and the reds got the better of the calm down no need to point out what he has done so far we all know lets talk about how to get him back to where he was so we are getting out of him what we all this team is going to the playoffs regardless of his performance it would just be nice if he contributed like he should be and i fully expect that he will pay dividends sooner rather than later
1,1032,no actually you shown me no source all recent data has been shipments idiot your other comments would hurt if you were actually relevant moron of the year explain how that still not dominant kid
0,1033,yeah so what the big deal letting iran and it friends know they can not trust their software nor trust in the safety or integrity of everything from their hardware to their people as they play with nuclear materials
0,1034,oh please she only has one face the pout and she really does need any more practise at that
0,1035,everyone has something to deal with some are ugly some are dumb some have crooked teeth some voted for obama
0,1036,lauren are you mad at me
0,1037,not for panetta of all people urging obama to give a green light on the operation bin laden is still walking around making video tapes and lopping the heads off americans if you want to kiss someone ass over osama start with leon then move on to the seals who got him
0,1038,all non eus move to london to earn wanted eslewhere
0,1039,i agree i just being sarcastic
0,1040,why the fuck did you tell her
1,1041,stop acting like a bitch was a kid for goodness sake
0,1042,ca keep liberal style lying your way thru truth will prevail i know thats anathema to need help
0,1043,you da best matt fowler
0,1044,romney is a business who has solid ideas about bringing jobs wants a strong military only as a deterrent to attacks by other countries all over the you liberals use the term tax cut which is false a true tax cut is when taxes get liberal version of a tax cut is when tax payers are allowed to keep some more of their hard earned money news flash to liberals not your money
0,1045,dude it was a satire english newspaper called the daily squib that made that means joke
0,1046,you do
0,1047,are you sure he even a real person
1,1048,well we know you are to dumb you only chose that screen name to satisfy your overgrown ego
0,1049,he used to be like himself
0,1050,mos po lyp me ja kthy virgjinitetin edhe motres apo nones tonde po e kan hup virgjinitetin ose e kan shit me pare e i njejti rast osht edhe me mitrovicen se baba jot hashim thadici e ka shit mitrovicen o kungull
0,1051,thunder fans are praying they toss duncan
0,1052,votto was in our farm before krusty ever came here so was bruce and cueto phillips was here too but not from our farm you idiot
0,1053,so you think there is no reason that a government needs to keep a secret classified info with you was wrong when it was scooter libby right
0,1054,you know a couple of young apes took her to abuse her only hope she comes back in one piece
0,1055,you are right
0,1056,evidently your not smart enough to do the same thing or you wouldnt be sitting on your lazy ass dropping spam on this website
1,1057,got a reference for that idiotic comment
0,1058,only if ronald mcdonald gives him time off from his regular job as a mcslave at mcdoonald
0,1059,how can a porn star compare herself to the mary
0,1060,i shall give you one reason one reason and you want to kill for that robocop remake fucking padhila
1,1061,to the idiots posting on here who think racism is alright it is nor and if you were a victim of racism then you would know feel like balli too and i would kick off as well even if meant i got arrested you seem them dumb fkin poles and ukranians racist bigots have a place sure they do the fkin gutter you know what would stop racism immediately or bring it to the forefront the racists were to throw swastikas at all the jewish players i bet the football bodies would take note immediately
0,1062,ho vieme len do vrecka
0,1063,lavendar is my favorite color but you can get it in any color to match your room
0,1064,you would hope so unfortunately when people are desperate and seeking a solution when there does not seem to be one they want to believe in anything that will help their child i ca fault them for loving their child that the other hand there are some people that will just believe anything a celebrity says just because that person is a celebrity
0,1065,spurs okc q min left
0,1066,stapler oh my god they best friend cheating on each other
0,1067,henry cases that you have cited are not applicable in this there is no known conflict statute within any us state with granting obama lfbc full faith and is there a credible record of a statement by obama that he was not born in hawaii as you have suggested
0,1068,job
1,1069,oh down and shut the fuccck uuuup you mental retard what the fuck do you know retard i hate people like you why dont you go get violently killed in a car accident you fucking retarded dick headed bitch mother fuckin ass hole
0,1070,hi glad you liked gambler she would be my alter ego if i had a bunch of moolah to alas this is not the i like the penny slots too but you can sure cram a heck of a lot of money into those machines if you not
0,1071,guess what op i a i real girl that i likes wearing make up i likes wearing my hair down i likes being dressed nice and sucks at call of duty s my strategy is to spin in a circle and shoot everywhere shoot those now
0,1072,a very rare pattern in the c position or sometimes referred to as the bullish doggy style manuever take your pick lol http suspect though someone has posted this my apologies not seen it
0,1073,maybe he is canadian would explain why he is gutted not to be going
0,1074,oh fuck yeah he not kidding guys it images from the attack and holy shit they are in a whole new world of graphic
1,1075,dick gets my vote james r is a very creepy looking man mr rogers look alike plus he whined like a little bitch when janelle destroyed him in the otev pov
0,1076,hey was thinking about you today i was listening to some old blues how is it going
0,1077,i have watched the video over and over again and with all the evidence ballotelli did not delibratly stamp on parkers head for a start parker was behind mario when he fell and in doing so knocked ballotelli off balance and tripped over hitting parker in the head that what the ref saw the rest is history
0,1078,yeah they pick up the trash then go thow it in the yard aroud their trailers
1,1079,go ahead and try dude go fucking ahead
0,1080,so a single parent is better get off your fucking high horse and shut the fuck up can you even imagine the trauma the two girls will feel and the loss of the other female partner wo change the other mother from being gay i hope you realize
1,1081,rob you have proven your point already we understood you are an antisemit you can relax now
0,1082,faux is a better source of animus
1,1083,it is a great honor to be a zionist you are garbage a retarded idiot
0,1084,sorry but that just a dumb statement you comparing some party promo to apple own functionality for example if this were a reference to a carrier removing google navigation and forcing customers to use telenav you have a valid argument but not in this case you want to make odd comparisons let talk about how the iphone fucked everyone on sprint who enjoyed contracts longer return periods and other perks that got taken away all because of the iphone see that why i like android because they do make the carrier take one up the ass and screw their users out of perks they enjoyed for years
1,1085,sgboy get back to your cot i hear your parents calling for you
0,1086,peevedmichelle um good question please email polly
0,1087,looks like you have a stormer problem same team that beat the bulls twice habs and jean were great morne hougaard was below par crusty the clown dont belong in this company
0,1088,joey barton only has a twitter account because he wants people to massage his ego
1,1089,you are a pig
0,1090,got your back here r dale good post typical of the gun nuts in utah
0,1091,his wrist might be bothering him he got a chip floating around in there
0,1092,based on the architecture stucco building and foliage and the dancing gay black kid i betting this is from florida
1,1093,fly away gay pusssy fly away
1,1094,we not the losers you and this country are
0,1095,you have a beautiful body what wrong with a man looking at a woman with a beautiful body especially nice hips if i stalker for that then every dude i know is a stalker as well
0,1096,like a case of cat on keyboard disease
0,1097,go get them kill them all we will be right behind hahahahehehe genesis will be a wild ass uncivilized of a man yismael and his descendants his hand will be against everyone meaning a robber per rashi and everyone hand will be against him meaning everyone will hate him and will attack him per rashi and in the presence of all his brothers he will dwell meaning his descendants will be many per rashi
1,1098,commenter your very grow up and be a stupid remarks like yours just proves that you are a little boy and have yet to understand what it means to be an adult
0,1099,awesome font and color on your card
0,1100,not tonight with brewer and dodger fans are just enjoying the they are hoping that their team ai it
1,1101,provide proof faggot
1,1102,your mother is the clubhouse whore
0,1103,your mother
0,1104,that because you posted all lies and bullshyt
0,1105,his poor mom she seemed pretty cool how the fuck did a person so nice end up raising such a cunt
1,1106,your testament and shove
1,1107,suck ya dads dick ya stupid slut he waiting u probably ugly as fuck damn i know it sucks to be you trollin on a joke i made fall back ihurt yo feelins ho
0,1108,god gave us free no matter what the sin is sin is a choice people were born somewhere in their environment or upbringing they chose that there are people who enter it and leave it every day
0,1109,i do go to the woods this time of year to hot chiggers i stick to shore until it cools off
0,1110,gloves on the baby please
0,1111,why do you think he be worth it
0,1112,there far worse things happening in africa and where your humanity towards than half of mali has been taken over by fsa best mates al quaida mauritania still has a slavery system going on chad niger darfur south sudan are on the brink of famine somalia once again fsa best mates al quaida ruining the country north eastern congo there deaths and mass rapes do you reckon some of the issues in africa are far worse than syrian regime battling terrorists
0,1113,you are spot on in regards to that little brat
1,1114,seems like you are on tik you moron are all people of your colour rapists of mothers and children i do think so stop making idiot comments
1,1115,you certainly come off as an arrogant your right ends when the safety of others begins i do give a rat arse that you hunt but keep your bullets along with your second hand smoke away from me sheffield village is a sprawling area and you are living in the past you sir may have to find a new piece of hunting paradise to fulfill your desires as far as history goes tyhe indians hunted all over places change get with it or get out
0,1116,existence of the interstate highway system hardly outweighs the vast amount of other problems with the federal hear a lot of you can thank bush and cheney from you but what has your precious obama done to reverse any of that oh
0,1117,thats what i thought about herge but turned out he was just opinionated as the other cheek
1,1118,whatisbannedisneversuppressed just a sorry ass commie are you too lazy to get out of bed to better easier to sit back and let others do the hard graft and hand over money to you to live your commie mind thinking big try working big that what benefits type make me sick to my core
1,1119,how stupid are you do you realize that many women take birth control pills for many reasons besides preventing pregnancy educate yourself fool
1,1120,fucking idiots
0,1121,durant needs to do something fine a way to get him free
0,1122,laird ans avila and santos may be among the tigers most marketable players at least as far as trading for a starting pitcher or a starting is concerned
1,1123,you a fighter not a lover and your family needs to die too
0,1124,but tna is full of wrestlers so should that be been wrestling too
0,1125,where do you find time to record an album when you on trial for murder
0,1126,puts politics between women and their what do they think they are doing both sides are putting politics between americans and their liberty as an aside the only reson the left wants people to have all the abortions they want is because they want to control who can and have children they want to create the master race rights sure like they actually care if they did have occupied the middle east a long time ago in the name of saving women from rape mutilation and murder
0,1127,i love a coach that can talk naughty
1,1128,you are a complete retard re read what you just said about a bullpen you know nothing about baseball
0,1129,tampa is loosing also they may give us yet another break
0,1130,to be honest dont you think that some fool made this fake twittwer account up
0,1131,there is no way roger maywheather said these things his account was definetely hacked into no man of his position will say these kind of things i mean he would talk about another man wife in that way
0,1132,is this a defensive stand for theo or an offensive jab at paolo they really are the same thing if you been reading him that long and dislike him that much then ignore his comments the irony is many of paolo views and opinions bring the good cub fan out of many of us rahrah the guy was a military drill instructor devoted to creating fearless fighters he just does it on a different scale now creating fearless fans out of fair weather fans just sayin man
0,1133,no they choose to be gay for the same reason jerry sandusky chooses to f boys in the rear it deviance and i agree once they are caught up in it it nearly impossible to stop but it is a
0,1134,last summer is suju right now this summer suju they forgot ahahahahah
0,1135,hey when you are in public or on the internet you cover your private areas with clothing we do want to see porn and that includes your butt
0,1136,it gets more and more like butlins as the weeks go on
1,1137,stfu u dirty ugly wet musty hair havin rican dirty ass wetback i swear i cant stand u dirty ugly pale face wannabe white spics postin racist bs on wshh when u the least disliked group of ppl in america ima spit in the next lil wetback kids face when i see em because of u
1,1138,that is a moronic response they should not repeat the crimes they commited please don t post your trash here
0,1139,please use your search engine before you look any or just go straight to the police information so far
1,1140,your kind i mean angry little yankee know it alls
0,1141,the fucking website said it worked for devices only now i in do have shsh blobs just learned about those ifaith recognize my ios and i have two different versions now do mean shit it great that you guys work so hard but check your posts
0,1142,ha ha wait until you have your own kids
1,1143,now you went and this whole page
0,1144,there are many great jews have no issue with the faith
1,1145,you know it is so easy to talk shit about this you know nothing about what he was going thorough in his life so fuck off
1,1146,look like brian scalabrine brother thoughts
0,1147,providing oil companies with billion to offset their costs for exploration is socialism is it not that little gift did not come from obama it came from bush
1,1148,and you need to know classified information because when it passes into history there is little anyone can do about it and in the meantime you really do need that information i guessing you just want to feel smug about getting it
0,1149,crap your chick as got a run
0,1150,yeah but we love a good smack down
0,1151,clintons shirt should read way to go barry i screwed a intern you screwed the whole country
0,1152,i think i in love with you
0,1153,they fucking slayed they just slayed everyone and my life with that sexy flawless epic performance
0,1154,i love serendipity frrrozen haute chocolate
0,1155,you shit me not what that all about
0,1156,it the title that matters in this case
0,1157,yes they are and ireland is the richest
0,1158,dear lord i believe you are guiding me to find my destiny there may be lost there may be obstacles there may be faliures there may be disappointments yet i never give up my fight for a wiser way of life may you be always with us and guide us away from getting lost
0,1159,obama is working as fast as he can
0,1160,easy to tell when it the off season should put a crossword puzzle on the blog
1,1161,you are an idiot do you even words
0,1162,and rape and incest self control too
0,1163,my big homo lil wayne fucks this nigga in his ass when it comes to music
0,1164,irony this has nothing to do with you just ca take off your rosecolored glasses long enough to see that there is a real problem a dodger stadium they need to tear that dump down and relocate
0,1165,is that why your head smells like obamas ass
0,1166,exactly is not sexist is also responsible for that complete fucking imbecile joe the plumber
0,1167,that the difference they ca just make a run and think they can win against the spur they have to be able to make stops when it counts young team bright future
1,1168,do you even realize you are making a fool of yourself i bet next you will post something like i forwarded your post to the fbi or maybe i told my mommy speaking of growing up get
0,1169,this is getting very silly headline my race hell a tad dramatic
0,1170,awww you go back checking your posts for likes how sad
1,1171,you stupid f uuu c i hope you die the same way she did
1,1172,but you could show any proof of that even if it was away you are an embarassment to your klan brothers your family your neighbors your teachers and america as a something to say that is not directly quoting nazi or stalinist propaganda most pathetic poster on the web you are below oberbite a soros trool or the ignorant little heap that wwrote waiting to exhale
0,1173,many ppl report seeing an officer pounding away at his chest while screaming breathe you mofo
0,1174,iv installed but siri just says unable to help please try later
0,1175,yes they are hope you are feeling better time heals everything no matter how many folks say this to you and no matter how much you think your life is over it not and it will hugs
