Insult,ID,Comment,,,,,,,,,,,,,,,,,,,,,,,,,,,,,,,,,,,,,,,,,,,,,,,,,,,,,,,,,,,,,,,,0,1956,romney steps in it with gay marriage line via buzzfeed which missed something of an attack angle from the right in this short romney riff on gay marriage romney says he wanted to stop the gay marriage ruling so it did go across the country too bad he was thinking that way when he implemented the model for obamacare at the state level as romneycare huh or was he video of romney http embedded uwm dan riehl
1,1957,black people can generalize based on race when did this happen dumb white boy your words not mine i thnk its clear you dont know what racism means
0,1958,that is funney because the doctors are saying you are not paying them so yah you have a suplus because you have not paid your bills
0,1959,liberals just can not stand the idea that their main outlet msnbc has ratings somewhere way behind re runs of try as they may with a mighty huff and puff from media matters they can not blow away fox no matter what they do
1,1960,you analysis is exceptionally american and by that i mean it entirely grounded in fact challenged star spangled retardation entirely voluntary in nature
0,1961,you are right logical
0,1962,here is a video of why republicans http why we suck
1,1963,hey jack a again it has been proven beyond a shadow of a doubt that your messiah is a lying fraud so called bc was and is a forgery your messiah is an anti american racists fraud you will all have to face that truth real soon you are a phukin moron
0,1964,you are welcome nikky
0,1965,jonklimasisnot a
0,1966,is it just me or can i not watch anything on this website anymore i tried several different computers and they all say the same thing that there an error on
0,1967,shit quality need better rip ug its so hard to find high quality hard trance
1,1968,people like you are the reason the economy is failing
0,1969,giving up with you now lying and perverting the course of justice are two completely different things which ca be used interchangably it does even matter what you say unless you are under arrest at the time as it is the actual arrest that gives them the power to repeat what you have said in court as in you do not have to say anything
0,1970,that looked like you at first glance
0,1971,boo mark zuckenberg you are a criminal you will face your crimes or face the penalties of you criminal on facebook
1,1972,leftist white race shit you are a hard one to
0,1973,zero fucks
0,1974,the mike smith the failed banking idiot
1,1975,i have a that has a inch bet that would fit better you wan na suck on it you will love the climax it has will damn near blow your mind
0,1976,i make a bold prediction now if dolan continues to beat this war drum it blow up in his face he is beginning to overreach perhaps his elevation to cardinal is getting to his the president has compromised and granted broad exemptions to faith based organizations with respect to providing health insurance products that violate their conscience what more does the clergy want for the president to kiss the ring of the cardinal soon this will become a story of catholic leadership whose moral standing remains questionable following the child molestation scandals waging war against women and the president not a war they can win
0,1977,lets all blow jeff carter now stfu he does nothing
0,1978,my wife was watching the grammy pre show the other night right up until this gutter whore and her old white pimp walked into the shot it amazing how a talentless piece of trash like this can make a living doing what she it to be expected from her industry
0,1979,no i have no family i was the product of immaculate i do exactly what he did but i abide by the rules of civilized society and would accept the consequences of killing another person
1,1980,you terrible and you got dislikes look like you an idiot just like ign orant
0,1981,indians scariest offensive teams ever
0,1982,i am almost more excited than you
1,1983,are you retarded harder bitch
0,1984,only fucking with number that prolly the only pair i can pull off these
0,1985,you are a kid waiting to go to work at the right that was funny you attemtping to be deep
0,1986,you sure it not lebron mom
0,1987,you are right
0,1988,whyyy i love that word
0,1989,i get how this works you work with congress unless it wo do what you want in which case you simply decree your will you are a child if you do understand what wrong with this
0,1990,thank you tania really appreciate your comment and you stopping by will definitely get back to a more regular blogging schedule as soon as my exams are over take care
1,1991,jeezus do you realize you are making a total fool of yourself you are criticizing someone for not knowing enough about one of the lowest firms of expression
0,1992,not only the team in their own division but also the team in the nation before the lsu game
1,1993,that is also part of the as is part of the old law and fits right in with the word on that has been out there from you are dumb or you do understand what you read thry figure it out before making such a stupid reply here is your chance to figure out my post
1,1994,well your buckwheat obama would qualify
0,1995,deb some of it will fix itself when you start to trust yourself more and do look to see where the ball went before you hit it
0,1996,can i suck your toes
0,1997,that would be the ex party chairman who set it up at the baptist church kinda like how he went there during ppp to dispose of certain ballots boy you people are really any of you go to the convention and reconvention or you all just talking smoke
0,1998,who cares now that we now that the is coming out fuck the evo
0,1999,ha ha now that funny thanks for the unwanted promotion btw have you seen that movie called sucker punch yeah kinda had a feelin that you like that one heat in six book it
1,2000,find that the majority of individuals posting here are of the opinion that by and large pick and choose which laws hold value it likely only those laws that control someone else behavior in your vernacular go fuck yourself and clean the slime you leave all the way back to fucks news asshole
0,2001,funny and very honest part of me thinks bell is very gutsy for sharing that video but the other part tells me that losing one over a petting zoo critter is just a little this side of weird
0,2002,so when is crawford coming back i drafted yhat bum
0,2003,truth never needs a hearing it just wing truth is only the truth
0,2004,bitch you gon na get hit meow
0,2005,henry cisneros democrat secretary of housing and urban development from to pleaded guilty to a misdemeanor charge of lying to the fbi traficant democrat member of house of representatives from ohio expelled from congress after being convicted of corruption charges sentenced today to eight years in prison for accepting bribes and kickbacks doug hays democrat member of kentucky state senate from to found guilty of mail fraud for submitting false campaign reports stemming from an unsuccessful run for judge he was sentenced to six months in prison to be followed by six months of home confinement and three years of probation cianfrani democrat pennsylvania state senate from to convicted on federal charges of racketeering and mail fraud for padding his senate payroll sentenced to five years in federal prison hall democrat governor of oklahoma from to indicted on extortion and conspiracy charges convicted and sentenced to three years in prison celona democrat a former state senator was charged with the three counts of mail fraud federal prosecutors accused him of defrauding the state and collecting hundreds of thousands of dollars from cvs and others while serving in the legislature celona has agreed to plead guilty to taking money from the cvs pharmacy chain and other companies that had interest in legislation under the deal celona agreed to cooperate with investigators he faces up to five years in federal prison on each of the three counts and a turner howe democrat representative from utah from to arrested for soliciting a policewoman posing as a p rostitute cosentino democrat illinois state treasurer pleaded guilty to bank fraud fined and sentenced to nine months home confinement waggonner democrat representative from louisiana from to arrested in washington for soliciting a policewoman posing as a p lafayette thomas democrat candidate for tennessee state house of representatives in sheriff of davidson county from to indicted in federal court on counts of abusing his power as sheriff pleaded guilty to theft and mail fraud sentenced to five years in prison rose oakar democrat representative from ohio from to pleaded guilty to two misdemeanor charges of funneling through fake donors giles democrat candidate for representative from washington in and convicted in june of child r ape siplin democrat state senator florida found guilty of third degree grand theft of or more a felony and using services of employees for his candidacy mezvinsky democrat representative from iowa from to indicted on federal fraud charges swanson democrat member of washington state senate in pleaded guilty to charges of soliciting unlawful payments from veterans and former prisoners of war hirschfeld democrat candidate in democratic primary for senator from new york in and offered paula jones million to drop her s exual harassment lawsuit against president bill clinton convicted in of trying to hire a hit man to k ill his business partner frank thompson democrat representative from new jersey from to implicated in the abscam sting convicted on bribery and conspiracy charges sentenced to three years in prisonmichael joseph myers democrat representative from pennsylvania from to lamar hastings democrat representative from florida impeached and removed from office as federal judge in over bribery barry democrat mayor of washington from to and again from to convicted of cocaine possession after being caught on videotape smoking crack cocaine sentenced to six months in biaggi democrat representative from new york from to indicted on federal charges that he had accepted bribes in return for influence on federal of obstructing justice and accepting illegal gratuities tried in on federal racketeering charges and convicted on felony alexander democrat mayor of syracuse from to was indicted over a million kickback scandal pleaded guilty to racketeering and tax evasion charges served six years in prison campbell democrat mayor of atlanta indicted and charged with fraud over claims he accepted improper payments from contractors seeking city contracts ballance democrat congressman north carolina pleaded guilty to one charge of conspiracy to commit mail fraud and money laundering related to mishandling of money by his charitable foundation democrat secretary of energy during the clinton administration took trips all over the world as secretary with as many staff members and at times rented a plane which was used by madonna during her concert tours dan walker democrat governor of illinois to served less than two years of a seven year sentence for receiving improper loans a decade after leaving office eastman studds democrat representative from massachusetts from to the first openly g ay member of congress censured by the house of representatives for having s exual relations with a teenage house page monserrate queens city councilman and state senator elect who has claimed to be an advocate of victims of domestic violence was arrested for breaking a glass over his girlfriend face a former cop won election to the state senate as a democrat in november green democrat north carolina state house of representatives from to charged with accepting a bribe from an undercover fbi agent but was acquitted convicted of tax evasion in frederick richmond democrat representative from new york from to arrested in washington in for soliciting s ex from a minor and from an undercover police officer pleaded guilty to a misdemeanor also charged with tax evasion marijuana possession and improper payments to a federal employee pleaded raymond lederer democrat representative from pennsylvania from to implicated in the abscam sting convicted of bribery and sentenced to three years in prison and fined harrison arlington williams democrat senator from new jersey from to implicated in the abscam sting allegedly accepted an interest in a titanium mine convicted of nine counts of bribery conspiracy receiving an unlawful gratuity conflict of interest and interstate travel in aid of racketeering sentenced to three years in prison and fined daniel david rostenkowski democrat representative from illinois from to indicted on felony charges pleaded guilty to two counts of misuse of public funds and sentenced to seventeen months in federal prison jay reynolds democrat representative from illinois from to convicted on sexual misconduct and obstruction of justice charges and sentenced to five years in prison bryant democrat nj state senator was convicted was found guilty on all counts against him including bribery and pension fraud coles diggs democrat representative from michigan from to convicted on eleven counts of mail fraud and filing false payroll forms sentenced to three years in prison george rogers democrat massachusetts state house of representatives from to of massachusetts state senate from to convicted of bribery in and sentenced to two years in prison siegelman democrat governor alabama indicted in a bid rigging scheme involving a maternity care program the charges accused siegelman and his former chief of staff of helping tuscaloosa physician phillip bobo rig bids siegelman was accused of moving from the state education budget to the state fire college in tuscaloosa so bobo could use the money to pay off a competitor for a state contract for maternity care murtha democrat representative from pennsylvania implicated in the abscam sting in which fbi agents impersonating a rab businessmen offered bribes to political figures murtha was cited as an unindicted co conspirator kerner democrat governor of illinois from to was jailed after the manager of two horse racing tracks admitted to bribing the then governor charges were filed after kerner left office he was convicted in barney frank democrat representative from massachusetts from to present admitted to having paid stephen gobie a male p rostitute for s ex and subsequently hiring gobie as his personal assistant gobie used the congressman washington apartment for p rostitution a move to expel frank from the house of representatives failed and a motion to censure him failed under a democratic majority dnc the federal election commission imposed in fines against participants in the democratic party fundraising scandals involving contributions from china korea and other foreign sources the federal election commission said it decided to drop cases against contributors of more than million in illegal dnc contributions because the respondents left the country or the corporations are defunct berger democrat national security advisor during the clinton administration berger fined for illegally removing highly classified documents and handwritten notes from the national archives during preparations for the commission hearings torricelli democrat withdrew from the senate race with less than days before the election because of controversy over personal gifts he took from a major campaign donor and questions about campaign donations from james mcgreevey democrat new jersey governor admitted to having a gay affair resigned after allegations of sexual harassment rumors of being blackmailed on top of fundraising investigations and indictments jackson democrat democratic candidate for president admitted to having an extramarital affair and fathering a illegitimate condit democrat us democratic congressman from california condit had an affair with an intern condit covered up the affair and lied to police after she went missing no charges were ever filed against condit her remains were discovered in a washington dc spitzer democrat new york governor resigned from office after being tied to a p rostitution ajumoke omokunde democrat the son of newly elected gwen moore was booked on charges of criminal damage to property for allegedly slashing tires on vans and cars rented by the republican party for use in election day voter turnout efforts anthony weiner democrat takes pictures of his p enis and t weets it to under age teen and six other women while his wife is carrying his child his p enis ends up on the internet for all of time and resigns from office edwards democrat extramarital affair admitted to in august by john edwards a former united states senator from north carolina and democratic party presidential candidate the affair was initially reported by the national enquirer an american supermarket tabloid newspaper but was given little or no coverage by many sources in the american mainstream media the enquirer cited claims by an anonymous source that edwards had engaged in the affair with rielle hunter a filmmaker hired to work for his presidential campaign and that the relationship had produced a child durin the time when his wife made a announcement that her cancer had returned and was found to be incurable elizabeth died on december democrat as a congressional ethics panel prepares to try maxine waters for steering federal funds to her failing bank a newspaper reports that the veteran california lawmaker is embroiled in a separate corruption scandal involving her beloved federal records the story says that a powerful lobbyist paid banker husband sidney williams in as she co sponsored a law aimed at saving a business that was among the top clients the internal revenue service irs had determined that the real estate finance firm and others like it were and the measure would have overturned a federal ban that would have allowed the shady enterprises to keep raking in lucrative years the firms acted as a middleman to help sellers finance down payments so that low income buyers could qualify for mortgages insured by the federal housing administration fha the lobbyist who paid husband represented the largest such middleman sacrament based nehemiah which stood to lose hundreds of millions of dollars if the ban reversed by friendly lawmakers like waters in the federal ban was never overturned but not for lack of effort on part the ten term congresswoman sponsored legislation three times to stop the ban or repeal it once it became law she claims she did it because the program allowed hundreds of thousands of low income families to become homeowners of this latest scandal comes as the house ethics committee prepares to try waters for using her influence to steer million in federal bailout funds to a failing bank that subsequently got shut down by the government in which she and her board member husband held shares few months ago the congresswoman got in trouble again for skirting federal elections rules with a crooked fundraising gimmick that allows her to receive unlimited amounts of donations from certain contributors instead of raising most of her campaign funds from individuals and political action committees waters sells her endorsement to other politicians and political causes for as much as a pop allowing her to rake in hundreds of thousands of dollars in short periods of time goldschmidt democrat oregon governor admitted to having an illegal sexual relationship with a year old teenager while he was serving as mayor of jefferson clinton democrat impeached by the house of representatives over allegations of perjury and obstruction of justice but acquitted by the senate after a s ex a scandal with an intern moore kennedy democrat senator from massachusetts pleaded guilty to leaving the scene of an accident after his car plunged off a bridge on chappaquiddick island killing passenger mary jo kopechne
0,2006,i liked your comment not because it was sensible but because it was so far ny
0,2007,blazeraddict blaine jungwirth afrika bambaataa yeah i got the same gift
0,2008,is it night time where you live
0,2009,why do schools worry about teaching instead of for real are our childrens educations suffering enough with every hippie retard in the world making it worse you freaks and you dainty feelings whining cause your parents whipped your little bad ass when u deserved it are screwing the whole thing up
0,2010,more than half of living medal of honor recipients have endorsed romney
0,2011,no list is complete without peach city in brigham city now that is a burger joint also how did hometown drive in make the list in laketown but not labeau labeau put the r in raspberry shakes
1,2012,get thatdick outta your mouth so you can talk
0,2013,i hope you are not setting the standard by using your real name on gc posts
0,2014,conference champs only we are not trying to pick the pecking order but give every school via their conference a path to play for the national championship is so simple to get right why do these clowns keep screwing it up your conference you play lose you do
0,2015,are
1,2016,you did read the article and you are a ignorant putz
0,2017,you are lucky to have any privileges at all after saying some of the most vile comments in the history of this blog
1,2018,are you really this stupid
0,2019,pitbulls are not banned in broward county put one inside your bussiness and wait for the stupid maggot to be pleseantly surprised by fido
0,2020,ya and feed him more chocolate
0,2021,disqus gunjan di plzzzzzz mujh se naaraz mat ho you are angry coz i thought to close my ff di maybe people do like it aur uss larki ne bhi kuch soch samajh kar hi comment kia hoga that my ff is not good plz mujh se gussa mat ho disqus sadaf di aap bhi mujh se gussa ho plz aap tou gussa mat ho actually di meri koi id nahi hai aur na hi mein fb per hun tou comment bhi apni behen ki id se karti hun do have an id waise aap ka chat box wala idea bura nahi hai
1,2022,stfu your existence offends me
1,2023,it much better than the left wingnuts who got us into this mess in the first place you susan
0,2024,you lack empathy is a fucking great drink
0,2025,just because owebama came out of the closet does mean you should all blindly follow suit
0,2026,hmmm new ios without new hardware to try on so far iphone announcements have been done at wwdc in the past numerous times already unless new ipod touch pops out of no where to demo it and bring siri to ipad will see tomorrow how it plays out
0,2027,i agree it is hard which is why i try to stay away from it because there is no way to really know who would be better
0,2028,yep you are officially addicted to polyvore am i p
0,2029,amazing eh talk about gaining experience and considering last year in college he probably only played games pretty incredible
1,2030,hoss you you old fuck the real john real one from die hard
0,2031,is the best manager in the world fact love to see jose do what mart does no chance
0,2032,waaaaaaaaaa waaaaaaaaaaaa to those libturds whine they know they are toast so and snip chihauhaus no offense to chihauhaus intended
0,2033,and we could put up a high stakes sure a few people would choose to do that too like young girls choose prostitution people choose to be crack heads the fact that you can blow the rent money on the roll of the dice and leave your children homeless is case in point
0,2034,we need to have a honest goverment and clean up all communists from any party now
0,2035,kagawa is going to sell shirts to their favourite
0,2036,to hear them say black huh okay now unhand yourself
0,2037,well he wants to ban gay marriage even in states where it is currently legal he wants to ban adoption for gay couples he thinks planned parenthood has a hidden agenda no abortions even in cases of rape
0,2038,there is a good team on the field idiot people get injured people slump to say gonzi and youk are no better at hitting than the fans is absolutely ridiculous and upsurd do rsn and the red sox a favor and stay at home and shut the f ck up you are a prime example of what i am talking about if you going to criticize then do it realisticly and stop pulling dumb sh t out of your a as for the rabbits foot i not talking about luck here i am talking about a behavoir of the fans that is bleeding into the club house you try and perform while constantly criticized and have to endure stupid comments like you i not saying it is the main problem but it certainly does not help anyone
1,2039,you really are a complete moron yo must be one of those incompetent welfare leeches who does nothing but put a drain on every hard working person in this country cut the cord do something with your pathetic life
0,2040,really when has it become cool to defend him
1,2041,nope it is a moron like you who needs to shut up
1,2042,you are simply comically or you just a depressing either way you still just a liar and an internet cheers
0,2043,cause you never know when you gon na need one lol o
0,2044,you are not better than your bedtime
1,2045,you are wrong idiot
0,2046,something tells me he is a burglar at night
0,2047,romney sounds really good now
0,2048,of course iran has been talking us to death for years in their development of nukes with obama and hillary they have willing allies to prolong it even further the israelis and believe or not the saudi and jordanians will not wait for obama knowing exactly who he supports the arabs have as much to lose because occupying them is also on irans time table simply put the iranians are shiite and the saudi and jordanians are sunni they hate each other deeply in this case enemy of my enemy is my friend at least for today
0,2049,getting your face ate off
1,2050,do you get tennis elbow from jacking off as much as you do
